[
  {
    "id": "ka-overview-what-a-council-does",
    "title": "What a kingdom council does, and what the game now does for it",
    "phase": "overview",
    "section": "overview",
    "order": 10,
    "stage": [
      "todos"
    ],
    "perfil": [
      "todos"
    ],
    "funcao": [
      "lider"
    ],
    "hours_min_per_day": null,
    "time_cost_min": null,
    "priority": 5,
    "recommended_for": [],
    "ch_range": null,
    "civ": [],
    "consensus": "mechanic",
    "split_views": null,
    "body_md": "**Two layers of power.** The game defines the **king** and the titles and skills that come with the throne, and below the king the **alliance ranks** (leader, Counselors, officers with customisable permissions) [B03-0003, B04-0001]. Everything else (the council, DKP, MGE lists, intake and exit rules) is made by the community and **varies by kingdom** [B03-0004, B03-0005].\n\n**What a council does, in ten recurring jobs:** agree the rules before KvK; pick who enters the Lost Kingdom; set and score requirements (DKP); manage exits; screen migrants; allocate MGE; hand out titles; keep alliances tidy; run event sign-ups; and handle diplomacy.\n\n**Since 2025 official tools cover part of this work:**\n\n| Job | Official tool (patch) | Still done outside the game |\n|---|---|---|\n| Titles | Title reservation with king/ruler approval or auto-approval (1.0.91), CH requirement per title (1.0.94) [B03-0002] | Little; some kingdoms still run queues or title bots |\n| Who enters the Lost Kingdom | Battle roster and domains (1.1.00–1.1.01), roster import code from the ROK Toolkit (1.1.02) [B02-0001]; Watchlist (1.1.00) [B02-0002] | Publishing the selection criteria |\n| Alliance housekeeping | 6 officer permission categories (1.0.96) [B04-0001]; Alliance Notes and Quick Checks (1.1.07) [B04-0002] | Private officer records, activity history |\n| Combat coordination | Army Groups and map markers (SoC) [B04-0005] | Cross-timezone scheduling |\n| SoC diplomacy | Team-ups, match vote, coalitions, Rest Mode vote [B09-0002] | Agreements inside the kingdom |\n| DKP and requirements | **None found.** No official per-governor stats export in notes 1.0.90–1.1.09 [B08-0003]; DKP has no official definition [B08-0001]. The ROK Toolkit's contents are unknown [B08-0007] | Scans, formula, publishing |\n| MGE allocation, intake screening, exit lists | **None** | All of it |\n\n**Default for a new council:** use every official tool for the jobs it covers, and spend your written rules and volunteer time on the jobs it does not (DKP, MGE, intake, exits).",
    "why_md": "Councils lose time maintaining bots, sheets and chat queues for jobs the game already does (titles are the clearest case [B03-0002]), while the jobs that cause the worst disputes (DKP, MGE, exits) have no official support at all. Knowing the split tells you where written rules and trusted people are needed.",
    "cards": [
      "B02-0001",
      "B02-0002",
      "B03-0002",
      "B03-0003",
      "B03-0004",
      "B03-0005",
      "B04-0001",
      "B04-0002",
      "B04-0005",
      "B08-0001",
      "B08-0003",
      "B08-0007",
      "B09-0002"
    ],
    "patch_cards": [],
    "confidence": "medium",
    "uncertain_notes": "B03-0004 (one leadership team / council per kingdom) is organizado/baixa: a community norm from a few voices. B03-0005 (informal enforcement) and B08-0003 (no official export) are organizado. Everything else in the table is official patch notes (verificado/alta).",
    "gaps": [
      "L-B08-01"
    ],
    "low_spender_note": null,
    "as_of": "2026-10-13",
    "patch_ref": "1.1.09 (latest official EN notes); 1.1.12 reported live (T3)"
  },
  {
    "id": "ka-roles-official-powers",
    "title": "Roles and official powers: king, Queen/General/PM, R5, officers",
    "phase": "overview",
    "section": "overview",
    "order": 20,
    "stage": [
      "todos"
    ],
    "perfil": [
      "todos"
    ],
    "funcao": [
      "lider"
    ],
    "hours_min_per_day": null,
    "time_cost_min": null,
    "priority": 5,
    "recommended_for": [],
    "ch_range": null,
    "civ": [],
    "consensus": "mechanic",
    "split_views": null,
    "body_md": "| Role | Official powers | Card |\n|---|---|---|\n| **King** | Opens and approves title reservations; king skills including **Watchlist**; battle roster and domain activation at Lost Kingdom registration; normal immigration power cap and special-immigration approval; Vacation Permits in SoC | B03-0002, B02-0002, B02-0001, B06-0002, B03-0007 |\n| **Queen, General, Prime Minister** | Since 1.0.96 can use **Imprison, Exile, Banish, Leader and Inspire** | B03-0003 |\n| **\"Rulers\"** | Since 1.1.03 can manage the Watchlist and approve title reservations; kings and rulers cannot be targeted by Watchlist or Banish. Who counts as a ruler is not defined in the notes | B02-0002, B03-0002 |\n| **Alliance leader (R5) and Counselors** | Customise each officer title's permissions across 6 categories; can cancel a building dismantle (1.1.03) | B04-0001 |\n| **Officers** | Whatever their title is granted; with permission: Alliance Notes, Quick Checks, markers | B04-0001, B04-0002 |\n\n**Watchlist limits (1.1.01):** it cannot target the top 100 by individual power in Imperium kingdoms or the top 50 in other kingdoms, but anyone under 50M power can be watchlisted regardless of rank; watchlisting someone already in the Lost Kingdom sends them home [B02-0002].\n\n**Banish** teleports a city to a random spot in the kingdom's upper-left province [B03-0003].\n\n**Do this:** give Queen, General and Prime Minister to trusted council members in **different time zones**, so king skills are available around the clock.",
    "why_md": "Since 1.0.96 kingship is shareable [B03-0003]. A kingdom where only the king can act stops working while the king sleeps or quits. The Watchlist's top-50/100 protection means it cannot be used against the strongest accounts [B02-0002], so plan rules that do not depend on it for them.",
    "cards": [
      "B02-0001",
      "B02-0002",
      "B03-0002",
      "B03-0003",
      "B03-0007",
      "B04-0001",
      "B04-0002",
      "B06-0002"
    ],
    "patch_cards": [],
    "confidence": "medium",
    "uncertain_notes": "B06-0002 is organizado/media: the king's control of the normal immigration cap comes from a T3 guide; special immigration itself is confirmed in official notes. Effects and cooldowns of Imprison, Exile, Leader and Inspire were not collected.",
    "gaps": [
      "L-B03-02",
      "L-B03-04",
      "L-B04-01",
      "L-B06-02"
    ],
    "low_spender_note": null,
    "as_of": "2026-10-13",
    "patch_ref": "1.1.09 (latest official EN notes); 1.1.12 reported live (T3)"
  },
  {
    "id": "ka-written-kingdom-rules",
    "title": "Write the kingdom rules down before KvK1, and publish them where players see them",
    "phase": "pre-kvk1",
    "section": "plan",
    "order": 30,
    "stage": [
      "todos"
    ],
    "perfil": [
      "todos"
    ],
    "funcao": [
      "lider"
    ],
    "hours_min_per_day": null,
    "time_cost_min": null,
    "priority": 5,
    "recommended_for": [],
    "ch_range": null,
    "civ": [],
    "consensus": "majority",
    "split_views": null,
    "body_md": "**What to write down (one page per item is enough):**\n1. **Who leads:** the council members, the king, who holds Queen/General/PM, and how the council decides.\n2. **Territory and flags:** which alliance holds which zone.\n3. **DKP formula and requirement**, with the date they apply from (see the DKP block).\n4. **MGE policy:** model, who gets the top slots, point caps for everyone else, penalty for breaking it.\n5. **Intake:** migration requirements, application route, which alliance new arrivals join.\n6. **Exits and enforcement:** what triggers a removal, notice period, appeal.\n7. **Titles:** which are reservable and on what terms.\n8. **Conduct:** no scripts or cheats (Conduct Score) and no sharing of logins.\n\n**Where kingdoms publish:** some kingdoms keep rule sites with pages for immigration, rules, DKP, titles and Ark of Osiris; many rely on unwritten rules passed on in chat or Discord [B07-0002]. Discord is the usual hub [B07-0001], and leaders broadcast through in-game mail and chat [B07-0003].\n\n**Official in-game places:** the **Kingdom Bugle** and **Lost Kingdom Bugle** pin a statement to the top of kingdom/Lost Kingdom chat (1.0.91); mail; alliance and coalition voice chat (1.0.99) [B07-0004]. No in-game translation feature appears in the 1.0.90–1.1.09 notes [B07-0004], so multilingual kingdoms need translated copies.\n\n**Our default:** keep one written source (site or document), pin a short summary with a link in the Bugle, and mail every change with its date.",
    "why_md": "Unwritten rules are the main way newcomers get punished for things nobody told them: one first-KvK player received a requirement of 250% of power by mail without knowing what DKP meant [B08-0002]. Migrants are expected to ask the king before moving, yet players report no in-game warning of such rules [B03-0006]. A written, dated rule also gives the council something to point to in a dispute instead of a memory of a chat message.",
    "cards": [
      "B03-0006",
      "B07-0001",
      "B07-0002",
      "B07-0003",
      "B07-0004",
      "B08-0002"
    ],
    "patch_cards": [],
    "confidence": "medium",
    "uncertain_notes": "B07-0002 (rule sites vs unwritten rules; only 2 sites found, sharing a template), B07-0003 (mail and chat as broadcast channels) and B03-0006 (approval-before-migrating norm) are organizado/baixa. B07-0001 and B08-0002 are organizado/media. The list of what to write down is this guide's synthesis of the jobs in the overview block, not a measured practice.",
    "gaps": [
      "L-B07-01",
      "L-B07-02"
    ],
    "low_spender_note": null,
    "as_of": "2026-10-13",
    "patch_ref": "1.1.09 (latest official EN notes); 1.1.12 reported live (T3)"
  },
  {